{
  "uuid": "a1f8c148-52db-424a-89a3-5c8fe2200007",
  "version": "1.0.0",
  "last_updated": "2026-06-25T16:52:00Z",
  "verification_status": "expert_verified",
  "source": "https://gov.in/compliance-directory",
  "applicable_state": "KA",
  "applicable_district": "Bengaluru",
  "confidence": 0.97,
  "tags": ["retail", "grocery", "supermarket"],
  "references": ["https://fssai.gov.in"],
  "dependencies": [],
  "business_category": "Retail Trade",
  "business_type": "Partnership",
  "primary_activity_code": "NIC-47110",
  "mandatory_license_uuids": [
    "fssai-retailer-lic-placeholder",
    "shop-est-lic-placeholder",
    "weights-measures-lic-placeholder"
  ]
}
