{
  "uuid": "a1f8c148-52db-424a-89a3-5c8fe2200008",
  "version": "1.0.0",
  "last_updated": "2026-06-25T16:52:00Z",
  "verification_status": "expert_verified",
  "source": "https://gov.in/compliance-directory",
  "applicable_state": "GJ",
  "applicable_district": "Ahmedabad",
  "confidence": 0.99,
  "tags": ["manufacturing", "factory", "industrial"],
  "references": [],
  "dependencies": [],
  "business_category": "Manufacturing Services",
  "business_type": "Private Limited",
  "primary_activity_code": "NIC-24101",
  "mandatory_license_uuids": [
    "factory-license-placeholder",
    "pollution-noc-placeholder",
    "power-sanction-placeholder"
  ]
}
